{
  "$schema": "../../schemas/openrazer-userspace-version-compatibility.schema.json",
  "capability_catalog_sha256": "3fb45b60ac50e4ff5f5e4938bcfdda69e5f383bf56152006efd2da3c72d734a7",
  "cases": [
    {
      "channel": "release",
      "client_declared_version": "3.6.0",
      "commit": "5b21a6c425617fb51ead5ff0e17ba3993b5147e2",
      "daemon_declared_version": "3.6.0",
      "daemon_owner_acquired": true,
      "devices": [
        {
          "client_enumerated": false,
          "daemon_enumerated": false,
          "definition": "absent",
          "device_kind": "mouse",
          "features": [],
          "profile_id": "child.razer.basilisk-v3-pro-35k.00cd",
          "required_problems": [],
          "semantic_probes": [],
          "state": "not-recognized-by-release"
        },
        {
          "client_enumerated": true,
          "daemon_enumerated": true,
          "definition": "present",
          "device_kind": "keyboard",
          "features": [
            {
              "id": "battery",
              "requirement": "optional",
              "state": "available"
            },
            {
              "id": "brightness",
              "requirement": "required",
              "state": "available"
            },
            {
              "id": "firmware-effects",
              "requirement": "optional",
              "state": "available"
            },
            {
              "id": "keyboard-modes",
              "requirement": "optional",
              "state": "available"
            },
            {
              "id": "lighting-core",
              "requirement": "required",
              "state": "available"
            }
          ],
          "profile_id": "child.razer.deathstalker-v2-pro-tkl.0296",
          "required_problems": [],
          "semantic_probes": [
            {
              "id": "get_device_name",
              "state": "passed"
            },
            {
              "id": "get_firmware",
              "state": "passed"
            },
            {
              "id": "get_serial",
              "state": "passed"
            },
            {
              "id": "get_vid_pid",
              "state": "passed"
            }
          ],
          "state": "compatible"
        }
      ],
      "display_version": "3.6.0",
      "id": "openrazer-3.6.0",
      "matched_source_pair": true,
      "overall_state": "compatible",
      "reported_version": "3.6.0",
      "version_probe_state": "reported"
    },
    {
      "channel": "release",
      "client_declared_version": "3.10.0",
      "commit": "2c5cfb1f3cf30c813bf1c1a11874a1e21190ce88",
      "daemon_declared_version": "3.10.0",
      "daemon_owner_acquired": true,
      "devices": [
        {
          "client_enumerated": true,
          "daemon_enumerated": true,
          "definition": "present",
          "device_kind": "mouse",
          "features": [
            {
              "id": "battery",
              "requirement": "optional",
              "state": "available"
            },
            {
              "id": "brightness",
              "requirement": "required",
              "state": "available"
            },
            {
              "id": "firmware-effects",
              "requirement": "optional",
              "state": "available"
            },
            {
              "id": "lighting-core",
              "requirement": "required",
              "state": "available"
            },
            {
              "id": "mouse-dpi",
              "requirement": "optional",
              "state": "available"
            },
            {
              "id": "mouse-idle",
              "requirement": "optional",
              "state": "available"
            },
            {
              "id": "mouse-polling",
              "requirement": "optional",
              "state": "available"
            },
            {
              "id": "mouse-scroll",
              "requirement": "optional",
              "state": "available"
            }
          ],
          "profile_id": "child.razer.basilisk-v3-pro-35k.00cd",
          "required_problems": [],
          "semantic_probes": [
            {
              "id": "get_device_name",
              "state": "passed"
            },
            {
              "id": "get_firmware",
              "state": "passed"
            },
            {
              "id": "get_serial",
              "state": "passed"
            },
            {
              "id": "get_vid_pid",
              "state": "passed"
            }
          ],
          "state": "compatible"
        },
        {
          "client_enumerated": true,
          "daemon_enumerated": true,
          "definition": "present",
          "device_kind": "keyboard",
          "features": [
            {
              "id": "battery",
              "requirement": "optional",
              "state": "available"
            },
            {
              "id": "brightness",
              "requirement": "required",
              "state": "available"
            },
            {
              "id": "firmware-effects",
              "requirement": "optional",
              "state": "available"
            },
            {
              "id": "keyboard-modes",
              "requirement": "optional",
              "state": "available"
            },
            {
              "id": "lighting-core",
              "requirement": "required",
              "state": "available"
            }
          ],
          "profile_id": "child.razer.deathstalker-v2-pro-tkl.0296",
          "required_problems": [],
          "semantic_probes": [
            {
              "id": "get_device_name",
              "state": "passed"
            },
            {
              "id": "get_firmware",
              "state": "passed"
            },
            {
              "id": "get_serial",
              "state": "passed"
            },
            {
              "id": "get_vid_pid",
              "state": "passed"
            }
          ],
          "state": "compatible"
        }
      ],
      "display_version": "3.10.0",
      "id": "openrazer-3.10.0",
      "matched_source_pair": true,
      "overall_state": "compatible",
      "reported_version": "3.10.0",
      "version_probe_state": "reported"
    },
    {
      "channel": "release",
      "client_declared_version": "3.12.2",
      "commit": "ddea89607b86023e88563b8feabc8fa2d5773cdd",
      "daemon_declared_version": "3.12.2",
      "daemon_owner_acquired": true,
      "devices": [
        {
          "client_enumerated": true,
          "daemon_enumerated": true,
          "definition": "present",
          "device_kind": "mouse",
          "features": [
            {
              "id": "battery",
              "requirement": "optional",
              "state": "available"
            },
            {
              "id": "brightness",
              "requirement": "required",
              "state": "available"
            },
            {
              "id": "firmware-effects",
              "requirement": "optional",
              "state": "available"
            },
            {
              "id": "lighting-core",
              "requirement": "required",
              "state": "available"
            },
            {
              "id": "mouse-dpi",
              "requirement": "optional",
              "state": "available"
            },
            {
              "id": "mouse-idle",
              "requirement": "optional",
              "state": "available"
            },
            {
              "id": "mouse-polling",
              "requirement": "optional",
              "state": "available"
            },
            {
              "id": "mouse-scroll",
              "requirement": "optional",
              "state": "available"
            }
          ],
          "profile_id": "child.razer.basilisk-v3-pro-35k.00cd",
          "required_problems": [],
          "semantic_probes": [
            {
              "id": "get_device_name",
              "state": "passed"
            },
            {
              "id": "get_firmware",
              "state": "passed"
            },
            {
              "id": "get_serial",
              "state": "passed"
            },
            {
              "id": "get_vid_pid",
              "state": "passed"
            }
          ],
          "state": "compatible"
        },
        {
          "client_enumerated": true,
          "daemon_enumerated": true,
          "definition": "present",
          "device_kind": "keyboard",
          "features": [
            {
              "id": "battery",
              "requirement": "optional",
              "state": "available"
            },
            {
              "id": "brightness",
              "requirement": "required",
              "state": "available"
            },
            {
              "id": "firmware-effects",
              "requirement": "optional",
              "state": "available"
            },
            {
              "id": "keyboard-modes",
              "requirement": "optional",
              "state": "available"
            },
            {
              "id": "lighting-core",
              "requirement": "required",
              "state": "available"
            }
          ],
          "profile_id": "child.razer.deathstalker-v2-pro-tkl.0296",
          "required_problems": [],
          "semantic_probes": [
            {
              "id": "get_device_name",
              "state": "passed"
            },
            {
              "id": "get_firmware",
              "state": "passed"
            },
            {
              "id": "get_serial",
              "state": "passed"
            },
            {
              "id": "get_vid_pid",
              "state": "passed"
            }
          ],
          "state": "compatible"
        }
      ],
      "display_version": "3.12.2",
      "id": "openrazer-3.12.2",